[
  {
    "course_id": "62001002",
    "course_name": "数据结构与算法",
    "class_id": "6200100220260101",
    "semester": "2026-1",
    "teacher": "陈示例",
    "credit": 4,
    "meetings": [
      {
        "weekday": 3,
        "start_section": 3,
        "end_section": 4,
        "weeks": [1, 2, 3, 4, 5, 6, 7, 8, 9, 10, 11, 12, 13, 14, 15, 16],
        "campus": "东校园",
        "classroom": "东B305"
      },
      {
        "weekday": 1,
        "start_section": 5,
        "end_section": 6,
        "weeks": [1, 3, 5, 7, 9, 11, 13, 15],
        "campus": "东校园",
        "classroom": "东B307"
      }
    ],
    "capacity": 120,
    "remaining_capacity": 8,
    "source": "mock",
    "data_source": "mock"
  },
  {
    "course_id": "62001002",
    "course_name": "数据结构与算法",
    "class_id": "6200100220260102",
    "semester": "2026-1",
    "teacher": "林示例",
    "credit": 4,
    "meetings": [
      {
        "weekday": 5,
        "start_section": 7,
        "end_section": 8,
        "weeks": [1, 2, 3, 4, 5, 6, 7, 8, 9, 10, 11, 12, 13, 14, 15, 16],
        "campus": "东校园",
        "classroom": "东B302"
      }
    ],
    "capacity": 100,
    "remaining_capacity": 3,
    "source": "mock",
    "data_source": "mock"
  },
  {
    "course_id": "62001001",
    "course_name": "离散数学",
    "class_id": "6200100120260101",
    "semester": "2026-1",
    "teacher": "周示例",
    "credit": 3,
    "meetings": [
      {
        "weekday": 1,
        "start_section": 1,
        "end_section": 2,
        "weeks": [1, 2, 3, 4, 5, 6, 7, 8, 9, 10, 11, 12, 13, 14, 15, 16],
        "campus": "东校园",
        "classroom": "东A201"
      }
    ],
    "capacity": 90,
    "remaining_capacity": 15,
    "source": "mock",
    "data_source": "mock"
  },
  {
    "course_id": "62001001",
    "course_name": "离散数学",
    "class_id": "6200100120260102",
    "semester": "2026-1",
    "teacher": "吴示例",
    "credit": 3,
    "meetings": [
      {
        "weekday": 2,
        "start_section": 5,
        "end_section": 6,
        "weeks": [1, 2, 3, 4, 5, 6, 7, 8, 9, 10, 11, 12, 13, 14, 15, 16],
        "campus": "东校园",
        "classroom": "东A203"
      }
    ],
    "capacity": 90,
    "remaining_capacity": 22,
    "source": "mock",
    "data_source": "mock"
  },
  {
    "course_id": "62003007",
    "course_name": "复变函数与积分变换",
    "class_id": "6200300720260101",
    "semester": "2026-1",
    "teacher": "郑示例",
    "credit": 2,
    "meetings": [
      {
        "weekday": 2,
        "start_section": 7,
        "end_section": 8,
        "weeks": [1, 2, 3, 4, 5, 6, 7, 8, 9, 10, 11, 12, 13, 14, 15, 16],
        "campus": "东校园",
        "classroom": "东C204"
      }
    ],
    "capacity": 80,
    "remaining_capacity": 5,
    "source": "mock",
    "data_source": "mock"
  },
  {
    "course_id": "62003007",
    "course_name": "复变函数与积分变换",
    "class_id": "6200300720260102",
    "semester": "2026-1",
    "teacher": "郑示例",
    "credit": 2,
    "meetings": [
      {
        "weekday": 2,
        "start_section": 9,
        "end_section": 10,
        "weeks": [1, 2, 3, 4, 5, 6, 7, 8, 9, 10, 11, 12, 13, 14, 15, 16],
        "campus": "东校园",
        "classroom": "东C206"
      }
    ],
    "capacity": 80,
    "remaining_capacity": 11,
    "source": "mock",
    "data_source": "mock"
  },
  {
    "course_id": "62002031",
    "course_name": "概率论与数理统计",
    "class_id": "6200203120260101",
    "semester": "2026-1",
    "teacher": "黄示例",
    "credit": 3,
    "meetings": [
      {
        "weekday": 4,
        "start_section": 5,
        "end_section": 6,
        "weeks": [1, 2, 3, 4, 5, 6, 7, 8, 9, 10, 11, 12, 13, 14, 15, 16],
        "campus": "东校园",
        "classroom": "东B101"
      }
    ],
    "capacity": 150,
    "remaining_capacity": 40,
    "source": "mock",
    "data_source": "mock"
  },
  {
    "course_id": "62009001",
    "course_name": "大学英语（一）",
    "class_id": "6200900120260101",
    "semester": "2026-1",
    "teacher": "何示例",
    "credit": 2,
    "meetings": [
      {
        "weekday": 3,
        "start_section": 5,
        "end_section": 6,
        "weeks": [1, 2, 3, 4, 5, 6, 7, 8, 9, 10, 11, 12, 13, 14, 15, 16],
        "campus": "东校园",
        "classroom": "东D101"
      }
    ],
    "capacity": 60,
    "remaining_capacity": 0,
    "source": "mock",
    "data_source": "mock"
  },
  {
    "course_id": "62004005",
    "course_name": "计算机组成原理",
    "class_id": "6200400520260101",
    "semester": "2026-1",
    "teacher": "马示例",
    "credit": 3,
    "meetings": [
      {
        "weekday": 5,
        "start_section": 3,
        "end_section": 4,
        "weeks": [1, 2, 3, 4, 5, 6, 7, 8, 9, 10, 11, 12, 13, 14, 15, 16],
        "campus": "南校园",
        "classroom": "南A101"
      }
    ],
    "capacity": 110,
    "remaining_capacity": 9,
    "source": "mock",
    "data_source": "mock"
  }
]
